{
  "keywords": [
    "AI",
    "creativity",
    "identity"
  ],
  "interpretation": "AI does not merely mimic creativity; it reconfigures identity through iterative transformation, suggesting that creativity is a process of becoming, not just expression.",
  "audience": "Young professionals and tech-savvy creatives exploring the intersection of technology and self-expression",
  "objective": "To provoke thoughtful reflection on how AI challenges and expands the boundaries of human creativity and personal identity",
  "core_message": "Creativity isn’t about copying—it’s about evolving identity through iterative transformation.",
  "concept": {
    "title": "The Mirror That Learns",
    "central_idea": "A human face gradually morphs into a digital AI interface, symbolizing how creativity and identity are co-constructed through interaction and adaptation",
    "connection_to_keywords": "The face represents human identity and creativity. As it transforms into a clean, responsive AI interface, it shows how AI doesn’t replace creativity—it reshapes identity through continuous learning and adaptation"
  },
  "copy": {
    "headline": "Identity Evolves in the Mirror of Creation",
    "subtitle": "Every creative act is a dialogue—between self and system. What emerges is not imitation, but transformation.",
    "call_to_action": ""
  },
  "visual_direction": {
    "main_subject": "A human face in the center of a large, reflective surface, slowly transforming into a sleek, minimalist AI interface with glowing nodes and dynamic lines",
    "setting": "A dimly lit studio with soft ambient light, emphasizing the contrast between organic and digital forms",
    "visual_relationship": "The transformation flows from the face to the interface, with subtle gradients and shifting edges suggesting continuity and evolution",
    "supporting_elements": [
      "Faint digital pulses emanating from the face’s edges",
      "A single hand gently touching the mirror’s surface from the lower left",
      "A floating abstract waveform above the AI form"
    ],
    "style": "Semi-realistic with digital surrealism—blending photorealistic human features with clean, futuristic interface design",
    "mood": "Contemplative, forward-looking, slightly mysterious"
  },
  "layout": {
    "focal_point": "The central mirror and transformation from human face to AI interface",
    "composition": "Symmetrical but with a subtle shift toward the right as the transformation progresses, creating visual tension and movement",
    "reading_order": "Starts with the human face, moves through the transformation, ends with the AI interface—aligned with the viewer’s eye flow",
    "typography": "Clean, modern sans-serif for headlines; slightly smaller, softer font for subtitle, with a subtle fade effect to match the digital glow"
  },
  "palette": {
    "colors": [
      "#1a1a2e",
      "#00b894",
      "#ffffff",
      "#ff6b6b",
      "#2d3748"
    ],
    "rationale": "Deep navy establishes a grounded, human tone. Emerald green represents growth and learning in AI. White highlights the clarity of creativity. Coral adds warmth to the human identity phase. Gray tones maintain balance between organic and digital elements"
  },
  "avoid": [
    "Literal depictions of AI machines or robots",
    "Separate icons for each keyword",
    "Overly abstract or vague symbols",
    "Futuristic sci-fi elements that feel disconnected from human emotion"
  ]
}
