{
  "keywords": [
    "repair",
    "community",
    "tomorrow"
  ],
  "interpretation": "A collective effort to rebuild and sustain a future, where individual acts of repair foster communal resilience.",
  "audience": "People who value social responsibility, environmental sustainability, and collective action.",
  "objective": "To inspire empathy and action for community-driven solutions that ensure a hopeful tomorrow.",
  "core_message": "Repairing today’s fractures strengthens tomorrow’s foundations, uniting communities in shared purpose.",
  "concept": {
    "title": "Tomorrow's Foundation: Repairing Together",
    "central_idea": "A community of hands and hearts collaborating to rebuild, symbolizing the interdependence of individual and collective action.",
    "connection_to_keywords": "Repair (literal and metaphorical) is the act of restoring, while community (shared effort) ensures sustainability, and tomorrow (future) represents the outcome."
  },
  "copy": {
    "headline": "Tomorrow's Foundation: Repairing Together",
    "subtitle": "A community of hands and hearts collaborating to rebuild, symbolizing the interdependence of individual and collective action.",
    "call_to_action": "Join the effort to repair what's broken—because tomorrow depends on today's unity."
  },
  "visual_direction": {
    "main_subject": "A group of hands interlocking in a workshop, holding tools and a blueprint.",
    "setting": "A sunlit community center with exposed beams, scattered materials, and a distant sunrise.",
    "visual_relationship": "Hands in a circle, arms reaching toward a central blueprint, with a single light source casting shadows of collective effort.",
    "supporting_elements": [
      "tools",
      "blueprint",
      "sunrise",
      "folding chairs",
      "smiling faces"
    ],
    "style": "Realistic with warm, earthy tones and soft lighting to evoke warmth and collaboration.",
    "mood": "Hopeful and communal, emphasizing shared responsibility."
  },
  "layout": {
    "focal_point": "The interlocked hands and the blueprint in the center, flanked by a crowd of people.",
    "composition": "Symmetrical balance with the blueprint as the dominant visual element, surrounded by materials and light.",
    "reading_order": "Headline at the top, subtitle below, call to action in the lower right.",
    "typography": "Bold, sans-serif headline with a warm color (e.g., terracotta), subtitle in a lighter tone, and call-to-action in a contrasting color."
  },
  "palette": {
    "colors": [
      "terracotta",
      "beige",
      "sunlight yellow",
      "deep blue",
      "white"
    ],
    "rationale": "Terracotta for warmth and repair, beige for community, sunlight yellow for hope, deep blue for stability, and white for clarity."
  },
  "avoid": [
    "generic directions",
    "sentimental copy",
    "brand affiliations"
  ]
}
