{
  "keywords": [
    "home",
    "migration",
    "memory"
  ],
  "interpretation": "A poignant moment of emotional displacement and introspection, where the tension between familiar and foreign becomes the core of the narrative.",
  "audience": "General public, particularly those interested in human experience, migration, and emotional storytelling.",
  "objective": "To evoke empathy and reflection through a visually evocative depiction of a moment of transition and nostalgia.",
  "core_message": "The act of migration is not just a physical journey but a reclamation of home, where memory and identity are shaped by the spaces we leave behind.",
  "concept": {
    "title": "The Weight of a New Home",
    "central_idea": "A single moment of transition where the familiar is replaced by the unknown, yet the memory of the past remains deeply embedded in the present.",
    "connection_to_keywords": "Home represents the past, migration is the journey, and memory is the emotional thread that binds the two."
  },
  "copy": {
    "headline": "Where Memory Lives",
    "subtitle": "A single moment of transition where the familiar is replaced by the unknown, yet the memory of the past remains deeply embedded in the present.",
    "call_to_action": "Explore the spaces that shape who you are."
  },
  "visual_direction": {
    "main_subject": "A child standing at the edge of a moving train platform, holding a small object that represents home (a photo album, a family heirloom, or a familiar item).",
    "setting": "A twilight hour, with the sky transitioning from warm hues of orange and pink to the cool blue of night, symbolizing the shift from day to night and from home to journey.",
    "visual_relationship": "The child is positioned in a frame of the train, with the train moving forward, suggesting the journey. The background is a blurred landscape of home, while the foreground is a quiet, reflective space of the child’s memory.",
    "supporting_elements": [
      "A small, faded photo album on the child's lap",
      "A single candle lit in the background",
      "A faint shadow of a familiar face in the distance"
    ],
    "style": "Minimalist and evocative, with a focus on texture and light to convey emotion.",
    "mood": "Reflective, nostalgic, and slightly melancholic."
  },
  "layout": {
    "focal_point": "The child’s face, with a soft expression of quiet resolve and longing.",
    "composition": "Symmetrical layout with the child centered, the train in the background, and the home landscape in the foreground.",
    "reading_order": "Headline at the top, subtitle below, and the main subject in the center with supporting elements in the background.",
    "typography": "A clean, modern sans-serif font for the headline, with a hand-painted or textured font for the subtitle and main subject to add visual interest."
  },
  "palette": {
    "colors": [
      "Warm orange and pink tones for the setting",
      "Cool blue and gray for the background and memory elements",
      "Soft white and muted tones for the child's clothing and the photo album"
    ],
    "rationale": "The warm colors evoke the feeling of home and memory, while the cool colors symbolize the journey and the unknown. The contrast between the two helps to highlight the emotional tension."
  },
  "avoid": [
    "Generic directions",
    "Factual claims",
    "Brand affiliations",
    "Sentimental copy alone"
  ]
}
