{
  "keywords": [
    "urban loneliness",
    "connection",
    "windows"
  ],
  "interpretation": "A cityscape where windows are both barriers and bridges, symbolizing the tension between isolation and connection.",
  "audience": "Urban professionals and residents seeking to foster community in fast-paced environments",
  "objective": "To inspire viewers to see windows as opportunities for connection, even in crowded spaces",
  "core_message": "In the city's glass towers, loneliness is a mirror—reflecting isolation but also a canvas for reimagining connection.",
  "concept": {
    "title": "Glass Mirrors",
    "central_idea": "Windows as dual-edged tools: they separate and reveal, yet hold the potential for human interaction.",
    "connection_to_keywords": "Urban loneliness (glass as a barrier), connection (glass as a bridge), and windows (the physical and metaphorical elements)"
  },
  "copy": {
    "headline": "See Beyond the Window",
    "subtitle": "Where Isolation Meets Connection",
    "call_to_action": "Look out. Share. Reconnect."
  },
  "visual_direction": {
    "main_subject": "A person standing in a city skyline, arms outstretched, gazing through a window",
    "setting": "A modern urban environment with glass skyscrapers and a bustling street below",
    "visual_relationship": "The person's face is framed by a window that reflects the city's glow, with a digital screen on the other side showing a community event",
    "supporting_elements": [
      "A street vendor's cart",
      "A group of people in a park",
      "A digital interface displaying a message"
    ],
    "style": "Minimalist with layered textures and warm lighting",
    "mood": "Hopeful and inviting"
  },
  "layout": {
    "focal_point": "The person's face and the window's reflection",
    "composition": "Symmetrical layout with the person centered, window on the left, cityscape on the right",
    "reading_order": "Headline at top, subtitle below, call to action at the bottom",
    "typography": "Bold, sans-serif headline with a gradient effect, subdued text in a warm color"
  },
  "palette": {
    "colors": [
      "warm amber for the city",
      "cool blue for the digital screen",
      "neutral gray for the person's skin"
    ],
    "rationale": "Contrasting colors to highlight the duality of windows, with neutral tones for the person to anchor the scene"
  },
  "avoid": [
    "generic directions",
    "factual claims",
    "brand affiliations"
  ]
}
