{
  "keywords": [
    "home",
    "migration",
    "memory"
  ],
  "interpretation": "Home, migration, and memory are not separate forces but stages in a continuous cycle of belonging and loss. The visual metaphor transforms a house into a living, breathing entity that shifts form with each migration, carrying fragments of memory like seeds.",
  "audience": "Adults reflecting on personal or family histories, particularly those with experiences of displacement or cultural movement.",
  "objective": "To evoke emotional resonance around the fluidity of identity and belonging through a tangible, visual representation of memory as a moving force.",
  "core_message": "Memory is not static—it travels with us, reshaping what we call home.",
  "concept": {
    "title": "The House That Moves",
    "central_idea": "A house is not fixed; it evolves as people migrate, carrying with it the physical and emotional traces of past lives.",
    "connection_to_keywords": "The house embodies 'home' as a place of origin and identity. Migration is shown as a physical journey where the house shifts location. Memory is visualized as translucent, glowing fragments embedded within the walls, which shift and reconfigure as the house moves."
  },
  "copy": {
    "headline": "Home Moves With Memory",
    "subtitle": "Every step forward carries the weight of what was left behind.",
    "call_to_action": ""
  },
  "visual_direction": {
    "main_subject": "A modern, minimalist house with translucent, glowing memory fragments embedded in its walls and floorboards",
    "setting": "A neutral, open landscape transitioning from rural to urban, with the house appearing in multiple locations across the scene",
    "visual_relationship": "The house is slightly distorted in each location—its walls are subtly warped or stretched—mirroring the emotional strain of migration. The memory fragments pulse gently, aligning with the movement of the house.",
    "supporting_elements": [
      "Faint silhouettes of past homes in the background",
      "A single path that leads from one house to the next",
      "A small child’s drawing tucked in a wall corner, visible only in one version"
    ],
    "style": "Surrealist realism with soft lighting and subtle distortions",
    "mood": "Reflective, bittersweet, hopeful"
  },
  "layout": {
    "focal_point": "The central house, slightly off-center, with memory fragments glowing from within",
    "composition": "Diagonal flow from left to right, showing the house in three stages of migration, each with a different emotional tone",
    "reading_order": "Eye moves from the leftmost house (still, rooted) to the center (in motion) to the rightmost (settled, transformed)",
    "typography": "Clean, serif font for the headline; soft, handwritten font for the subtitle, placed below the image"
  },
  "palette": {
    "colors": [
      "soft terracotta",
      "cloud white",
      "warm gray",
      "pale blue glow"
    ],
    "rationale": "Terracotta and white represent the groundedness of home and the neutrality of memory. The pale blue glow symbolizes memory as something delicate, alive, and ever-present, even when the physical form changes."
  },
  "avoid": [
    "a map of migration routes",
    "individual icons for home, migration, memory",
    "overly literal depictions of houses or people",
    "a static or final destination image"
  ]
}
