{
  "keywords": [
    "AI",
    "creativity",
    "identity"
  ],
  "interpretation": "AI as a collaborative mirror: reflecting and reimagining identity through creativity.",
  "audience": "General public interested in technology, art, or personal development.",
  "objective": "Inspire reflection on AI's role in shaping identity and creativity.",
  "core_message": "AI is a collaborative partner in exploring and redefining identity through creative expression.",
  "concept": {
    "title": "The Mirror of Tomorrow",
    "central_idea": "A digital mirror reflecting both human identity and AI-generated creativity.",
    "connection_to_keywords": "AI (digital reflection) + creativity (artistic expression) + identity (self-perception)."
  },
  "copy": {
    "headline": "The Mirror of Tomorrow: Where AI and Creativity Shape Your Identity",
    "subtitle": "Explore the boundaries of self and innovation.",
    "call_to_action": "Discover your unique blend of AI and creativity."
  },
  "visual_direction": {
    "main_subject": "A human figure in a mirrored space, with a glowing digital interface behind them.",
    "setting": "A hybrid of a futuristic lab and a natural landscape, blending organic and synthetic elements.",
    "visual_relationship": "The figure's reflection is a dynamic fusion of their real self and an AI-generated creative canvas.",
    "supporting_elements": [
      "glowing circuit patterns",
      "brushstrokes of digital art",
      "light beams through the mirror"
    ],
    "style": "Abstract surrealism with a touch of photorealism",
    "mood": "Introspective yet visionary"
  },
  "layout": {
    "focal_point": "The figure's eye in the mirror",
    "composition": "Symmetrical balance with the AI interface on the right side",
    "reading_order": "Headline at top, subtitle below, call to action at bottom",
    "typography": "Modern sans-serif with a gradient effect for the mirror"
  },
  "palette": {
    "colors": [
      "deep navy blue",
      "neon cyan",
      "warm gold"
    ],
    "rationale": "Navy for depth, cyan for digital innovation, gold for creativity and identity"
  },
  "avoid": []
}
