{
  "keywords": [
    "time",
    "consumption",
    "ocean"
  ],
  "interpretation": "Time and consumption are not neutral—they shape the health of the ocean, and the ocean, in turn, reflects our collective choices over time.",
  "audience": "Environmentally conscious young adults and urban dwellers concerned with sustainability and long-term ecological impact",
  "objective": "To provoke awareness that individual consumption habits, when sustained over time, directly degrade ocean ecosystems and that change requires intentional, long-term action",
  "core_message": "Our consumption today is shaping the ocean’s future—time is not a neutral backdrop, it is a force of consequence.",
  "concept": {
    "title": "Time in the Tide",
    "central_idea": "The ocean acts as a long-term archive of human consumption, and every choice made over time leaves a visible mark in the marine environment.",
    "connection_to_keywords": "Time is not a passive element—it is the axis along which consumption patterns accumulate. The ocean becomes the physical manifestation of that accumulation, showing how short-term habits evolve into long-term ecological damage."
  },
  "copy": {
    "headline": "What You Consume Today Will Be in the Ocean Tomorrow",
    "subtitle": "",
    "call_to_action": ""
  },
  "visual_direction": {
    "main_subject": "A long, vertical timeline stretching from the surface of the ocean to the deep sea, with consumption symbols (plastic bottles, fast fashion tags, single-use packaging) embedded at different time intervals",
    "setting": "A deep-sea environment rendered in soft, desaturated tones, with the timeline emerging like a fossilized record from the ocean floor",
    "visual_relationship": "The timeline runs vertically from top (present day) to bottom (future/far future), with consumption symbols growing in scale and density as time progresses, symbolizing compounding impact",
    "supporting_elements": [
      "A single, glowing seashell at the top of the timeline representing awareness",
      "Faint wave patterns that ripple outward from the timeline, suggesting movement and time passing"
    ],
    "style": "Minimalist, scientific illustration with a slightly eerie, haunting tone",
    "mood": "Reflective, urgent, and slightly melancholic—like watching a slow-motion collapse"
  },
  "layout": {
    "focal_point": "The vertical timeline extending from the surface to the deep sea",
    "composition": "Diagonal composition leading from the top-left to the bottom-right, with the timeline centered and slightly angled to suggest time’s flow",
    "reading_order": "Start at the top of the timeline (present), move downward through consumption markers, ending in the deep sea where impact is irreversible",
    "typography": "Clean, modern sans-serif font for headline; smaller, lighter font for timeline labels; all text aligned to the left with subtle drop shadows to enhance depth"
  },
  "palette": {
    "colors": [
      "deep ocean blue (#0b2a4c)",
      "faded turquoise (#a0d8e8)",
      "charcoal gray (#2d2d2d)",
      "glowing white (#ffffff)",
      "slate silver (#888888)"
    ],
    "rationale": "The dominant deep blue establishes a sense of depth and timelessness. Faded turquoise suggests the surface world and consumption patterns. Charcoal and silver provide contrast and structure. The glowing white symbolizes awareness and potential change, subtly illuminated at the top of the timeline."
  },
  "avoid": [
    "overcrowding with symbols",
    "explicit images of dead animals or pollution",
    "data charts or statistics",
    "overly dramatic or emotional tone",
    "references to brands or products"
  ]
}
