{
  "keywords": [
    "urban loneliness",
    "connection",
    "windows"
  ],
  "interpretation": "A quiet, emotionally charged moment in a city where isolation is both visible and felt, yet a fragile human connection emerges through shared space and sight.",
  "audience": "Young adults living in urban environments who feel disconnected from others despite being surrounded by people.",
  "objective": "To evoke empathy for urban loneliness while highlighting the subtle, powerful potential of human connection through shared observation.",
  "core_message": "Connection does not require words — it begins when two people see each other through a window, in silence, in the same city.",
  "concept": {
    "title": "Through the Glass",
    "central_idea": "A single moment of mutual recognition between two strangers in an urban setting, framed by windows that serve as both barrier and bridge.",
    "connection_to_keywords": "The windows symbolize urban loneliness — a physical and emotional divide — while also representing the possibility of connection through shared gaze and silent understanding."
  },
  "copy": {
    "headline": "You don’t have to speak to be seen.",
    "subtitle": "",
    "call_to_action": ""
  },
  "visual_direction": {
    "main_subject": "Two figures standing on opposite sides of a city building, each looking through a window at the other.",
    "setting": "A midday urban street corner, with tall glass buildings, blurred movement in the background, and a narrow alley between them.",
    "visual_relationship": "The figures are positioned at slightly different angles, their silhouettes aligned in the frame, with the windows forming a diagonal line that connects them across the space.",
    "supporting_elements": [
      "A single raindrop on one windowpane",
      "A faint reflection of one figure in the other’s window",
      "A streetlamp casting a long shadow on the pavement"
    ],
    "style": "Minimalist realism with soft lighting and slight blur in the background to emphasize focus on the central moment.",
    "mood": "Quiet, contemplative, gently hopeful"
  },
  "layout": {
    "focal_point": "The overlapping gaze through the windows, centered in the composition.",
    "composition": "Diagonal framing of the two figures across the window line, with negative space on either side to emphasize isolation and stillness.",
    "reading_order": "Eye moves from the lower left corner (one figure) to the upper right (the other), naturally following the diagonal line of the windows.",
    "typography": "Clean, sans-serif font for the headline; placed slightly above the central subject, aligned to the left edge to avoid blocking the visual flow."
  },
  "palette": {
    "colors": [
      "cool gray",
      "soft white",
      "dull silver",
      "deep blue shadow"
    ],
    "rationale": "The cool, muted tones reflect the emotional atmosphere of urban loneliness, while the subtle contrast between light and shadow in the windows suggests a fragile but real connection emerging from silence."
  },
  "avoid": [
    "facial expressions",
    "textured backgrounds",
    "crowds or people in motion",
    "sentimental clichés",
    "overly bright or warm colors"
  ]
}
