{
  "keywords": [
    "AI",
    "creativity",
    "identity"
  ],
  "interpretation": "A moment of existential tension between human creativity and the erosion of individual identity in an age of AI-driven tools.",
  "audience": "Young professionals, creatives, and tech-savvy individuals exploring their role in a rapidly evolving digital world.",
  "objective": "To provoke reflection on the symbiotic relationship between human ingenuity and technological augmentation.",
  "core_message": "The interplay between AI's transformative power and the fragile, human-centric essence of identity.",
  "concept": {
    "title": "The Algorithm's Mirror",
    "central_idea": "A human being's struggle to reconcile their evolving identity with the tools that redefine their creative potential.",
    "connection_to_keywords": "AI (the tool) and creativity (the act) are both forces shaping identity, but the poster questions whether identity is being rewritten by technology."
  },
  "copy": {
    "headline": "When Algorithms Paint Our Souls",
    "subtitle": "A reflection on the duality of creation and self in an AI-driven era.",
    "call_to_action": "Explore your own creative boundaries."
  },
  "visual_direction": {
    "main_subject": "A person standing before a digital canvas, their face reflected in a mirror behind them.",
    "setting": "A minimalist, modern studio with glowing computer screens and a single lamp casting soft light.",
    "visual_relationship": "The person's face is framed by the mirror, with the AI interface in the background. The canvas shows a digital artwork that morphs in real-time.",
    "supporting_elements": [
      "Digital artwork in motion",
      "A glowing AI interface",
      "A single, unbroken mirror reflecting the person's face"
    ],
    "style": "Cyberpunk-inspired with a focus on surrealism and human-scale details.",
    "mood": "Contemplative and introspective"
  },
  "layout": {
    "focal_point": "The person's face in the mirror",
    "composition": "Symmetrical layout with the person centered, the AI interface in the lower left, and the artwork in the upper right.",
    "reading_order": "Headline (top), subtitle (center), call to action (bottom)",
    "typography": "Headline: bold, neon-cyan sans-serif; subtitle: serif with a glowing effect; call to action: clean, sans-serif"
  },
  "palette": {
    "colors": [
      "Neon cyan (AI)",
      "Warm amber (creativity)",
      "Neutral gray (identity)"
    ],
    "rationale": "Neon cyan represents AI's influence, amber signifies the warmth of human creativity, and neutral gray symbolizes the tension between technology and self."
  },
  "avoid": [
    "Generic impact statements",
    "Factual claims",
    "Sentimental copy"
  ]
}
