{
  "keywords": [
    "home",
    "migration",
    "memory"
  ],
  "interpretation": "Home is not a fixed place but a living memory shaped by movement and belonging.",
  "audience": "Individuals experiencing displacement or cultural change, particularly young adults and immigrants.",
  "objective": "To evoke a sense of emotional connection to place, emphasizing that identity and belonging persist through migration.",
  "core_message": "Home lives in memory, not just in geography.",
  "concept": {
    "title": "Where Memory Lives",
    "central_idea": "The emotional essence of home endures across time and space, even when physical locations change.",
    "connection_to_keywords": "Migration disrupts physical homes, but memory preserves the emotional core of home, linking past and present across borders."
  },
  "copy": {
    "headline": "Home is not a place. It’s a feeling remembered.",
    "subtitle": "Every step away carries a memory that returns to shape who we are.",
    "call_to_action": ""
  },
  "visual_direction": {
    "main_subject": "A fragmented mosaic of childhood homes, each composed of familiar objects like a window, a chair, a photograph, arranged in a spiral that leads into a single open doorway.",
    "setting": "A twilight landscape with soft, blurred edges, suggesting both memory and transition.",
    "visual_relationship": "The individual fragments are slightly tilted and layered, creating a sense of movement and displacement, while the central doorway remains consistent in form and orientation, symbolizing enduring belonging.",
    "supporting_elements": [
      "A child’s shoe tucked under a table",
      "A faded family photo with a handprint",
      "A single tree with roots spreading into the ground"
    ],
    "style": "Semi-realistic with soft, painterly textures and gentle layering",
    "mood": "Reflective, tender, and quietly hopeful"
  },
  "layout": {
    "focal_point": "The central doorway, slightly illuminated from within, positioned at the center of the poster.",
    "composition": "Radial symmetry with the mosaic elements spiraling outward from the doorway, creating a sense of journey and return.",
    "reading_order": "The viewer’s eye begins at the doorway, moves outward into the mosaic, and then settles on the headline above.",
    "typography": "Headline in a clean, serif font with slight shadow to suggest depth; subtitle in a smaller, lighter weight with soft fade to match the mood."
  },
  "palette": {
    "colors": [
      "warm terracotta",
      "soft sage green",
      "dusty gray",
      "golden amber"
    ],
    "rationale": "The warm tones evoke nostalgia and emotional warmth, while the soft greys and sage create a sense of distance and transition, mirroring the experience of migration."
  },
  "avoid": [
    "maps or geographic markers",
    "explicit dates or locations",
    "overly symbolic or abstract shapes",
    "crowded or chaotic arrangements"
  ]
}
