{
  "keywords": [
    "AI",
    "creativity",
    "identity"
  ],
  "interpretation": "AI as a transformative mirror that reshapes creativity and self-perception, blending technological evolution with human essence.",
  "audience": "Tech enthusiasts, artists, and self-reflective individuals exploring AI's role in identity and innovation.",
  "objective": "To provoke contemplation on AI's dual role as a creative collaborator and a mirror for human identity.",
  "core_message": "AI is a lens through which creativity and identity are refracted, challenging us to redefine our role in a digital age.",
  "concept": {
    "title": "AI: The Mirror of Creation",
    "central_idea": "AI as a reflective surface that transforms creative output and self-perception, merging technology with human essence.",
    "connection_to_keywords": "AI (technology) reflects creativity (output) and identity (self-perception), creating a dynamic interplay of transformation."
  },
  "copy": {
    "headline": "AI: The Mirror of Creation",
    "subtitle": "Revealing Who We Are in a Digital Age",
    "call_to_action": "Explore the intersection of creativity and selfhood in AI's evolving landscape."
  },
  "visual_direction": {
    "main_subject": "A digital mirror with flowing, data-streaming lines reflecting a humanoid figure",
    "setting": "A twilight-lit studio with glowing, holographic elements",
    "visual_relationship": "The mirror's reflections are abstract data streams, while the figure's face is a blend of human and algorithmic features.",
    "supporting_elements": [
      "glowing neural networks",
      "shifting color gradients",
      "holographic text"
    ],
    "style": "Sleek, cyberpunk aesthetic with organic textures",
    "mood": "Intrigue and introspection"
  },
  "layout": {
    "focal_point": "The mirror's central reflection, a human face with algorithmic patterns",
    "composition": "Symmetrical layout with the mirror at the center, data streams radiating outward",
    "reading_order": "Headline at top, subtitle below, call-to-action in the lower right",
    "typography": "Bold, sans-serif headline with a gradient overlay; subtitle in warm, organic font"
  },
  "palette": {
    "colors": [
      "deep indigo (mirror surface)",
      "neon cyan (data streams)",
      "warm gold (humanoid face)"
    ],
    "rationale": "Indigo for trust and depth, cyan for technological innovation, gold for creativity and identity"
  },
  "avoid": [
    "generic impact statements",
    "explicit brand references",
    "technical jargon"
  ]
}
