{
  "keywords": [
    "time",
    "consumption",
    "ocean"
  ],
  "interpretation": "A single, decisive moment in which a person confronts the irreversible loss of time through the consumption of the ocean's resources, symbolizing both environmental degradation and personal regret.",
  "audience": "Environmental advocates and individuals reflecting on personal responsibility and time's passage",
  "objective": "To evoke emotional resonance around the irreversible impact of human consumption on natural systems and to prompt introspection on time and stewardship",
  "core_message": "Time is not infinite; once consumed by the ocean, it cannot be reclaimed.",
  "concept": {
    "title": "The Last Tide",
    "central_idea": "A person stands at the edge of a receding shoreline, holding a single plastic bottle in one hand and a watch in the other, as the ocean pulls back, revealing sand and the ghost of a once-thriving coastline.",
    "connection_to_keywords": "The moment captures time as both a personal measure (the watch) and a natural force (the tide). Consumption is embodied in the plastic bottle, a symbol of human waste entering the ocean. The ocean's retreat represents the irreversible loss of time and ecological balance."
  },
  "copy": {
    "headline": "Time is not a resource. It is a tide.",
    "subtitle": "One bottle. One watch. One moment when the ocean remembers what we forgot.",
    "call_to_action": ""
  },
  "visual_direction": {
    "main_subject": "A lone figure standing at the edge of a receding shoreline, hand holding a plastic bottle and a broken watch",
    "setting": "A coastal area at dawn, where the ocean has retreated, exposing dry sand and the outline of a former dune line",
    "visual_relationship": "The figure is slightly tilted, facing the horizon, with the ocean in the background, receding into a soft gradient of blue and gray",
    "supporting_elements": [
      "A single, cracked plastic bottle half-buried in sand",
      "A broken watch lying on the sand, its hands frozen at 3:17",
      "A faint, ghostly reflection of waves in the still water at the edge of the shore"
    ],
    "style": "Minimalist realism with subtle cinematic lighting",
    "mood": "Quiet, melancholic, and introspective"
  },
  "layout": {
    "focal_point": "The figure at the edge of the shore, centered in the frame with the bottle and watch in close proximity",
    "composition": "Diagonal composition from the figure's feet to the horizon, creating a sense of movement and time passing",
    "reading_order": "Headline at top center, subtitle below, visual subject occupies central field with supporting details in lower third",
    "typography": "Clean, serif font for headline; thin, neutral sans-serif for subtitle; both aligned to center with slight drop shadows for depth"
  },
  "palette": {
    "colors": [
      "desaturated blue",
      "ochre sand",
      "gray",
      "white",
      "dark navy"
    ],
    "rationale": "The desaturated blue reflects the distant, fading ocean. Ochre sand emphasizes the dry, exposed ground. Gray and white create a sense of stillness and timelessness, while dark navy adds depth to the horizon and sky, reinforcing the gravity of the moment."
  },
  "avoid": [
    "facial expressions",
    "crowds",
    "animals",
    "textured backgrounds",
    "overly emotional or sentimental language"
  ]
}
