{
  "keywords": [
    "urban loneliness",
    "connection",
    "windows"
  ],
  "interpretation": "A cityscape where windows act as bridges between isolation and human connection.",
  "audience": "Urban dwellers seeking to foster community and belonging.",
  "objective": "To inspire action through visual storytelling of shared human experience.",
  "core_message": "Windows are the invisible threads that weave loneliness into connection.",
  "concept": {
    "title": "The Window's Secret",
    "central_idea": "Urban windows as metaphors for human connection and shared experience.",
    "connection_to_keywords": "Loneliness is the void between windows, while connection is the light that illuminates them."
  },
  "copy": {
    "headline": "Bridges Between Us",
    "subtitle": "A city's pulse meets the quiet strength of a shared glance.",
    "call_to_action": "Open your window, let the world see you."
  },
  "visual_direction": {
    "main_subject": "A silhouette of a person standing in a city skyline, holding a phone and a book, looking out a window.",
    "setting": "A modern urban environment with glass towers and streetlights.",
    "visual_relationship": "The person's face is framed by the window, with the cityscape behind them, and a group of people reflected in the glass.",
    "supporting_elements": [
      "A street scene in the background",
      "A digital screen showing a social media feed",
      "A faint outline of a hand reaching through the window"
    ],
    "style": "Minimalist with a digital aesthetic, blending realism and abstract elements.",
    "mood": "Hopeful and reflective, emphasizing the quiet power of connection."
  },
  "layout": {
    "focal_point": "The person's face and the window, with the cityscape as the background.",
    "composition": "Symmetrical layout with the person centered, windows on the left and right sides.",
    "reading_order": "Headline at the top, subtitle below, call to action at the bottom.",
    "typography": "Bold, modern font for the headline; serif for the subtitle with a subtle digital texture."
  },
  "palette": {
    "colors": [
      "navy blue (for the cityscape)",
      "warm gold (for the person's hands)",
      "soft white (for the window glass)"
    ],
    "rationale": "Navy blue evokes the vastness of the city, warm gold symbolizes human connection, and white represents clarity and transparency."
  },
  "avoid": [
    "generic directions",
    "factual claims",
    "brand affiliations"
  ]
}
