{
  "keywords": [
    "urban loneliness",
    "connection",
    "windows"
  ],
  "interpretation": "In the dense, impersonal environment of cities, people are physically present yet emotionally isolated—windows serve as both barriers and bridges, reflecting the tension between solitude and the possibility of human connection.",
  "audience": "Young adults living in urban environments who feel disconnected despite being surrounded by people",
  "objective": "To evoke empathy for urban loneliness while offering a hopeful vision of connection through shared human experiences reflected in windows",
  "core_message": "Connection is not found in distance, but in the shared gaze across a window.",
  "concept": {
    "title": "Gazes Across Glass",
    "central_idea": "Windows act as mirrors of emotional states—showing not just separation, but the potential for silent, meaningful connection between strangers.",
    "connection_to_keywords": "The urban setting establishes loneliness; windows symbolize both isolation and the opportunity for connection; the act of gazing across a window becomes the visual metaphor for reaching across emotional distance."
  },
  "copy": {
    "headline": "Gazes Across Glass",
    "subtitle": "In cities where people live close but feel far apart, a single look through a window can bridge the gap.",
    "call_to_action": ""
  },
  "visual_direction": {
    "main_subject": "A series of city windows with people inside, each looking out with subtle expressions of introspection or quiet hope",
    "setting": "Midday in a dense urban neighborhood—gray sky, rain-slicked streets, buildings with tall, narrow windows",
    "visual_relationship": "The windows are arranged in a diagonal line across the frame, with overlapping reflections showing different people gazing outward, some with eyes closed, some with open, thoughtful stares",
    "supporting_elements": [
      "A single streetlamp casting a warm glow on one window",
      "Faint raindrops on the glass, creating a sense of weathered intimacy",
      "A shared reflection in one window showing two figures in the distance, their silhouettes subtly aligned"
    ],
    "style": "Minimalist realism with soft chiaroscuro lighting and muted textures",
    "mood": "Quietly reflective, tender, slightly melancholic with a hint of hope"
  },
  "layout": {
    "focal_point": "The center of the diagonal line of windows, where the gaze of one person meets the reflection of another",
    "composition": "Diagonal flow from upper left to lower right, with windows gradually receding into depth, creating a sense of space and emotional distance",
    "reading_order": "Eye moves from the upper left (a solitary figure) to the lower right (a shared reflection), culminating in the central gaze that connects two individuals",
    "typography": "Clean, thin sans-serif font for headline; slightly smaller, soft-weight font for subtitle; centered and aligned with the focal window"
  },
  "palette": {
    "colors": [
      "steel gray",
      "deep slate",
      "soft off-white",
      "warm amber",
      "faint silver"
    ],
    "rationale": "The dominant grays reflect the urban atmosphere and emotional isolation, while warm amber and soft white introduce human warmth and the possibility of connection. Silver highlights the reflective quality of the windows, reinforcing the theme of gaze and mirroring."
  },
  "avoid": [
    "overcrowded scenes",
    "explicit facial expressions",
    "solutions or advice",
    "familiar icons like phones or coffee shops",
    "bright or cheerful color schemes"
  ]
}
